[
  {
    "id": "git-commit-update-file",
    "severity": "S2",
    "pattern": "^Update\\s+[a-zA-Z0-9_.-]+\\.(js|ts|tsx|css|md|html|json)$",
    "flags": "im",
    "scope": [
      "git",
      "txt"
    ],
    "message": "Default GitHub web-UI commit message (`Update index.html`).",
    "fix": "Explain what changed and why (`Raise body line-height to 1.8 for Arabic legibility`).",
    "positiveExample": "Update index.html",
    "negativeExample": "Raise body line-height to 1.8 for Arabic legibility"
  },
  {
    "id": "git-commit-initial-giant",
    "severity": "S2",
    "pattern": "^(Initial\\s+commit|first\\s+commit|init)$",
    "flags": "im",
    "scope": [
      "git",
      "txt"
    ],
    "message": "Generic `Initial commit` message often hiding a single-commit code dump.",
    "fix": "Describe the initial baseline (`Initialize tariff calculator schema and CLI`).",
    "positiveExample": "first commit",
    "negativeExample": "Initialize tariff calculator schema and CLI"
  },
  {
    "id": "git-commit-wip-temp",
    "severity": "S1",
    "pattern": "^(wip|WIP|temp|test|asdf|fix|fixes|stuff|minor\\s+changes)$",
    "flags": "im",
    "scope": [
      "git",
      "txt"
    ],
    "message": "Single-word throwaway commit message.",
    "fix": "Squash WIP commits before delivery and write a specific imperative summary.",
    "positiveExample": "wip",
    "negativeExample": "Validate customs declaration HS codes against 2026 table"
  },
  {
    "id": "git-commit-emoji-prefix",
    "severity": "S1",
    "pattern": "^(✨|🚀|🐛|♻️|💄|📝|🎉|🔥|⚡|✅)\\s+",
    "flags": "im",
    "scope": [
      "git",
      "txt"
    ],
    "message": "Emoji prefix in commit subject.",
    "fix": "Use plain text imperative commit subjects.",
    "positiveExample": "✨ Add dark mode support",
    "negativeExample": "Add high-contrast dark surface tokens"
  },
  {
    "id": "git-commit-ai-generated-note",
    "severity": "S0",
    "pattern": "(Generated\\s+by|Created\\s+with)\\s+(Claude|Cursor|ChatGPT|Copilot|v0|Bolt|Lovable|Aider)",
    "flags": "im",
    "scope": [
      "git",
      "txt"
    ],
    "message": "Commit message attributing authorship to an AI agent.",
    "fix": "Write commit messages from the engineering team's perspective.",
    "positiveExample": "Generated by Claude Code",
    "negativeExample": "Extract container demurrages into separate line items"
  },
  {
    "id": "git-commit-co-authored-ai",
    "severity": "S0",
    "pattern": "Co-authored-by:\\s*[^\\n]*(Claude|Copilot|Cursor|gpt|aider|anthropic|openai)",
    "flags": "im",
    "scope": [
      "git",
      "txt"
    ],
    "message": "AI `Co-authored-by` trailer in git log.",
    "fix": "Strip AI co-author trailers.",
    "positiveExample": "Co-authored-by: Claude <noreply@anthropic.com>",
    "negativeExample": "Reviewed-by: Hany Adel <hany@portsaid.eg>"
  },
  {
    "id": "git-commit-feat-comprehensive-ai",
    "severity": "S1",
    "pattern": "^feat:\\s+implement\\s+comprehensive\\s+",
    "flags": "im",
    "scope": [
      "git",
      "txt"
    ],
    "message": "LLM-style `feat: implement comprehensive ...` subject.",
    "fix": "Name the exact component or behavior added.",
    "positiveExample": "feat: implement comprehensive authentication system",
    "negativeExample": "Add WebAuthn passkey registration endpoint"
  },
  {
    "id": "git-commit-refactor-enhance",
    "severity": "S2",
    "pattern": "^refactor:\\s+enhance\\s+and\\s+optimize\\s+",
    "flags": "im",
    "scope": [
      "git",
      "txt"
    ],
    "message": "Vague LLM `refactor: enhance and optimize ...` message.",
    "fix": "State the concrete metric or structural change.",
    "positiveExample": "refactor: enhance and optimize database queries",
    "negativeExample": "Replace N+1 shipment lookup with single JOIN on waybill_id"
  },
  {
    "id": "git-commit-polish-ui-ux",
    "severity": "S2",
    "pattern": "^(chore|style|feat):\\s+polish\\s+UI/UX\\s+and\\s+improve\\s+responsiveness$",
    "flags": "im",
    "scope": [
      "git",
      "txt"
    ],
    "message": "Generic multi-file AI sweep commit message.",
    "fix": "Say which breakpoint or component was fixed.",
    "positiveExample": "style: polish UI/UX and improve responsiveness",
    "negativeExample": "Fix tariff table horizontal overflow at 320px viewport"
  },
  {
    "id": "git-commit-fix-all-issues",
    "severity": "S1",
    "pattern": "^fix:\\s+(fix\\s+all\\s+(lint|type|build)\\s+(errors|issues)|address\\s+review\\s+feedback)$",
    "flags": "im",
    "scope": [
      "git",
      "txt"
    ],
    "message": "Non-specific batch fix commit message.",
    "fix": "Describe the bug or invariant fixed.",
    "positiveExample": "fix: fix all type errors",
    "negativeExample": "Narrow ShipmentStatus union in customs webhook handler"
  },
  {
    "id": "git-commit-claude-robot-footer",
    "severity": "S0",
    "pattern": "🤖\\s*Generated\\s+with",
    "flags": "im",
    "scope": [
      "git",
      "txt"
    ],
    "message": "Robot emoji footer in commit body.",
    "fix": "Remove automated commit footers.",
    "positiveExample": "🤖 Generated with Claude Code",
    "negativeExample": "Add Arabic Eastern numeral formatter"
  },
  {
    "id": "git-commit-bolt-export",
    "severity": "S0",
    "pattern": "Exported\\s+from\\s+(Bolt|Lovable|v0|StackBlitz)",
    "flags": "im",
    "scope": [
      "git",
      "txt"
    ],
    "message": "Generator export commit message.",
    "fix": "Re-initialize clean git history organized by logical subsystem.",
    "positiveExample": "Exported from Lovable",
    "negativeExample": "Add client brief and direction statement"
  },
  {
    "id": "git-commit-cursor-checkpoint",
    "severity": "S0",
    "pattern": "^cursor\\s+checkpoint\\b",
    "flags": "im",
    "scope": [
      "git",
      "txt"
    ],
    "message": "Automated Cursor checkpoint commit.",
    "fix": "Squash checkpoints into meaningful commits.",
    "positiveExample": "cursor checkpoint",
    "negativeExample": "Parse CIF value in EGP and USD"
  },
  {
    "id": "git-commit-aider-prefix",
    "severity": "S0",
    "pattern": "^aider:\\s+",
    "flags": "im",
    "scope": [
      "git",
      "txt"
    ],
    "message": "Automated `aider:` commit prefix.",
    "fix": "Write human commit subjects without tool prefixes.",
    "positiveExample": "aider: refactor walk.mjs",
    "negativeExample": "Skip node_modules and .git when walking project tree"
  },
  {
    "id": "git-commit-lovable-sync",
    "severity": "S0",
    "pattern": "^Sync\\s+with\\s+Lovable\\b",
    "flags": "im",
    "scope": [
      "git",
      "txt"
    ],
    "message": "Automated Lovable sync commit.",
    "fix": "Remove generator sync commits.",
    "positiveExample": "Sync with Lovable",
    "negativeExample": "Update port handling fee table for Q4"
  },
  {
    "id": "git-commit-v0-import",
    "severity": "S0",
    "pattern": "^Add\\s+v0\\s+generated\\s+component\\b",
    "flags": "im",
    "scope": [
      "git",
      "txt"
    ],
    "message": "Commit message referencing v0 generation.",
    "fix": "Describe the UI component in domain terms.",
    "positiveExample": "Add v0 generated component",
    "negativeExample": "Add cold-chain temperature alert banner"
  },
  {
    "id": "git-commit-addressed-pr-comments",
    "severity": "S2",
    "pattern": "^Address\\s+PR\\s+comments$",
    "flags": "im",
    "scope": [
      "git",
      "txt"
    ],
    "message": "Uninformative PR follow-up message.",
    "fix": "Squash fixups or state what changed.",
    "positiveExample": "Address PR comments",
    "negativeExample": "Guard against zero-weight manifest lines"
  },
  {
    "id": "git-commit-oops",
    "severity": "S2",
    "pattern": "^(oops|whoops|forgot\\s+file|typo\\s+fix\\s+again)$",
    "flags": "im",
    "scope": [
      "git",
      "txt"
    ],
    "message": "Unpolished scratch commit message.",
    "fix": "Squash into the parent commit before merging.",
    "positiveExample": "oops",
    "negativeExample": "Include schema.json in pattern loader validation"
  },
  {
    "id": "git-commit-merge-main-spam",
    "severity": "S3",
    "pattern": "^Merge\\s+branch\\s+'main'\\s+into\\s+",
    "flags": "im",
    "scope": [
      "git",
      "txt"
    ],
    "message": "Repeated noisy merge commits in feature branch.",
    "fix": "Rebase feature branches cleanly before merging.",
    "positiveExample": "Merge branch 'main' into feature-x",
    "negativeExample": "Add RTL logical property check to scan-rtl"
  },
  {
    "id": "git-commit-auto-commit",
    "severity": "S1",
    "pattern": "^Auto-commit\\s+at\\s+[0-9]{4}-[0-9]{2}-[0-9]{2}",
    "flags": "im",
    "scope": [
      "git",
      "txt"
    ],
    "message": "Timestamped auto-commit message.",
    "fix": "Write deliberate commits per logical change.",
    "positiveExample": "Auto-commit at 2026-10-21T12:00:00Z",
    "negativeExample": "Add contrast checker for WCAG 2.2 AA pairs"
  }
]
